name,description
truth,Fluent assertions for Java and Android
autoparse,A dynamically generated parsing system using JSON Schema.
anvil-build,A parallel build system and content pipeline
googletv-android-samples,Source for many GoogleTV Example applications.
ChannelPlate,JavaScript library for postMessage over MessageChannel
qpp,Querypoint Debugging Prototype
CSP-Validator,CSP-Validator
module-server,module-server
cxx-std-draft,C++ standards drafts
filesystem-proposal,Boost Filesystem Library with modifications for the C++ standards committee proposal
libcxx,libc++; cloned from http://llvm.org/git/libcxx.git
tracing-framework,Web Tracing Framework libraries and extensions.
namebench,namebench
devtoolsExtended,devtoolsExtended: Extended Chrome Devtools in a Chrome Extension
sirius,sirius
testRunner,testRunner
episodes.dart,A framework for timing performance of web apps.
cpp-netlib,"The C++ Network Library Project -- header-only, cross-platform, standards compliant networking library."
dagger,A fast dependency injector for Android and Java.
ios-webkit-debug-proxy,A DevTools proxy (Chrome Remote Debugging Protocol) for iOS devices (Safari Remote Web Inspector).
build-debian-cloud,Script to create Debian Squeeze & Wheezy Amazon Machine Images (AMIs) and Google Compute Engine images
traceur-compiler,Traceur is a JavaScript.next-to-JavaScript-of-today compiler
vector_math.dart,A vector math package for 2D and 3D applications
developer.github.com,GitHub API documentation
latency-benchmark,Tests web browser input latency and jank
google-api-cpp-client,The core C++ SK for using Google APIs
gwtmockito,Better GWT unit testing
gwteventbinder,Making GWT EventBus easy
lisp-koans,"Common Lisp Koans is a language learning exercise in the same vein as the ruby koans, python koans and others.   It is a port of the prior koans with some modifications to highlight lisp-specific features.  Structured as ordered groups of broken unit tests, the project guides the learner progressively through many Common Lisp language features. "
dart-collab,An operational transform library for Dart
auto,A collection of source code generators for Java.
go-github,Go library for accessing the GitHub API
google-api-ruby-client-samples,Samples for the Google API Ruby Client
pinject,A pythonic dependency injection library.
html-quiz,"A stand-alone, HTML+JavaScript quiz script."
paco,The Paco behavioral science mobile research platform
uri.dart,Utilities for working with URIs in Dart
protobuf.dart,Runtime library for Dart protobufs
data-layer-helper,JavaScript library for working with dataLayer message queues.
carfac,Cascade of Asymmetric Resonators with Fast-Acting Compression cochlear model.
dpy,Python Inversion of Control (AKA Dependency Injection!)
webdriver.dart,Dart WebDriver client
mockable_filesystem.dart,Utility library that can be used to write code that can in turn be tested with mocked files and directories.
gumbo-parser,An HTML5 parsing library in pure C99
quiver-dart,A set of utility libraries for Dart
closure-library,Google's common JavaScript library
patchfield,Audio infrastructure for Android
dart-sync-socket,A Dart VM Native Extension and supporting Dart libraries that provide synchronous socket and HTTP client support.
compile-testing,Testing tools for javac and annotation processors
memcache-collections,"Concurrent, distributed data structures on top of memcache"
go-querystring,go-querystring is Go library for encoding structs into URL query strings.
tiff,Go package for working with the file structure of a TIFF.
dart-sync-webdriver,WebDriver API for Dart
lmctfy,"lmctfy is the open source version of Google’s container stack, which provides Linux application containers."
tsviewdb,High-performance storage and graphing web service for time-series of time-series.
vpn-reverse-tether,"VPN-based USB ""reverse tether"""
gfw-deployments,Scripts and tools created by the Google For Work Team. (Contributions Encouraged!)
pepper.js,Pepper applications as Native Client or JavaScript
grinder.dart,"Dart workflows, automated"
capsicum-linux,Linux kernel with Capsicum support
capsicum-test,Test suite for Capsicum
jimfs,An in-memory file system for Java 7+
blockly,The web-based visual programming editor.
gfw-toolkit,Enterprise command-line scripts and samples for Google Apps Admin SDK.
libkml,Reference implementation of OGC KML 2.2
gae-channel-api.dart,App Engine Channel API for Dart
container-rfc,An RFC for a standard container format
liquidfun,2D physics engine for games
grr,GRR Rapid Response: remote live forensics for incident response
vim-maktaba,Consistent Vimscript
benchmark,A microbenchmark support library
angular_node_bind.dart,Utilities to allow Angular templates to use Node.bind()
grafika,Grafika test app
skia,"Skia is a complete 2D graphic library for drawing Text, Geometries, and Images."
skia-buildbot,"Build, Test, and Analysis Tools for Skia Infrastructure"
instant-hangouts,Easily add Google+ Hangouts to any web page.
extra-keyboards-for-chrome-os,Extra keyboard layouts and input methods for Chrome OS
systemjs,A minimal System loader
radioreceiver,An application to listen to broadcast stereo FM and AM radio from your Chrome browser or your ChromeBook computer using a $15 USB digital TV tuner.
j2objc,A Java to iOS Objective-C translation tool and runtime.
pygtrie,Python library implementing a trie data structure.
page-timer,A personal time-tracking Chrome extension
sre_yield,Python module to generate regular all expression matches
dart-tagtree,A React-like UI framework in Dart
FakeMaker,Devtool ext. to create DOM 'fake' for JS benchmarks 
grr-doc,Documentation for the GRR Rapid Reponse framework
vroom,Launch vim tests
snappy,A fast compressor/decompressor
vimdoc,Helpfile generation for vim 
palette.js,"Script for generating colour palettes for use with graphs, charts and cartography."
pyringe,Debugger capable of attaching to and injecting code into python processes.
quiver-log,Logging utility for Dart
autofdo,AutoFDO
iosched,The Google I/O Android App
souper,A superoptimizer for LLVM IR
web-starter-kit,Web Starter Kit - a workflow for multi-device websites
closure-compiler,A JavaScript checker and optimizer.
closure-templates,A client- and server-side templating system that helps you dynamically build reusable HTML and UI elements
shaka-packager,"A media packaging and development framework for VOD and Live DASH and HLS applications, supporting Common Encryption for Widevine and other DRM Systems."
ohmu,Compiler intermediate language for static analysis.
lab_device_proxy,Executes adb and idevice commands on a remote host.
WebFundamentals,Best practices for modern web development
canvas-5-polyfill,HTML 5 Canvas Polyfill
closure-stylesheets,"A CSS+ transpiler that lints, optimizes, and I18n-izes"
capsicum-man-pages,Man page updates for Capsicum on Linux
jsaction,JsAction is a small event delegation library that decouples event binding from the code that can handle the event.
gtest-parallel,Run Google Test suites in parallel.
rekall,Rekall Memory Forensic Framework
flatbuffers,FlatBuffers: Memory Efficient Serialization Library
rekall-profiles,Public Profile Repository for Rekall Memory Forensic.
certificate-transparency,Auditing for TLS certificates.
certificate-transparency-rfcs,Certificate Transparency RFC
ct-hackday-schwag,"May 7th, 2014 Certificate Transparency Hack Day "
libpam-policycache,Password caching module with advanced policies for PAM.
libnss-cache,"a NSS module for reading directory service information for Linux hosts from an indexed, local disk cache"
nsscache,asynchronously synchronise local NSS databases with remote directory services
cronutils,utilities to assist running periodic batch processing jobs
mtail,extract internal monitoring data from application logs for collection in a timeseries database
guice,"Guice (pronounced 'juice') is a lightweight dependency injection framework for Java 6 and above, brought to you by Google."
guava,Google core libraries for Java
kernel-sanitizers,"Linux Kernel Sanitizers, fast bug-detectors for the Linux kernel"
tink,"Tink is a multi-language, cross-platform, open source library that provides cryptographic APIs that are secure, easy to use correctly, and hard(er) to misuse."
u2f-ref-code,U2F reference implementations
cadvisor,Analyzes resource usage and performance characteristics of running containers.
ExoPlayer,An extensible media player for Android
fruit,"Fruit, a dependency injection framework for C++"
chrome-language-immersion,Experience a new language while you browse the web.
timesketch,Collaborative forensic timeline analysis
domaintest,Domain Test service for new TLDs.
codeworld,Educational computer programming environment using Haskell
xsecurelock,X11 screen lock utility with security in mind
battery-historian,"Battery Historian is a tool to analyze battery consumers using Android ""bugreport"" files."
midi-dump-tools,A collection of tools that dump MIDI to a variety of formats
catnip,Catnip Sandbox
python-adb,Python ADB + Fastboot implementation
openrtb-doubleclick,"Utilities for DoubleClick Ad Exchange, including OpenRTB mapping, DoubleClick cryptography, metadata and validation"
openrtb,OpenRTB model for Java and other languages via protobuf; Helper OpenRTB libraries for Java including JSON serialization
files.dart,A filesystem API with implementations for multiple environments
dart-emacs-plugin-unsupported,Unsupported
tern-closure,A Tern plugin adding Closure support.
polymer-dart-log-controller,"A small polymer element which lets you control the global logging configuration, and can optionally log all statements to the console."
charted,Visualization toolkit for Dart language
gofuzz,Fuzz testing for go.
cpython-pt,Fork from python/cpython
byterun,A Python implementation of a Python bytecode runner
btree,"BTree provides a simple, ordered, in-memory data structure for Go programs."
jsonnet,Jsonnet - The data templating language
ktsan,"Kernel Thread Sanitizer, a fast data race detector for the Linux kernel"
forcefield,Keep email out of your inbox when you're not at work.
CausalImpact,An R package for causal inference in time series
pandas,"Flexible and powerful data analysis / manipulation library for Python, providing labeled data structures similar to R data.frame objects, statistical functions, and much more"
region-flags,Collection of flags for BCP 47 region codes in SVG / PNG
web-starter-kit-extras,Optional additions to Web Starter Kit
chromeos-filesystems,Additional file system providers for Chrome OS
paramgmt,A parallel SSH-based remote machine management system
googleapis.dart,Repository for building the googleapis packages
skicka,Command-line utility for working with Google Drive. Join the mailing list at https://groups.google.com/forum/#!forum/skicka-users.
rct-automation,Radio automation software (not an official google product)
macops,"Utilities, tools, and scripts for managing and tracking a fleet of Macintoshes in a corporate environment"
re2,"RE2 is a fast, safe, thread-friendly alternative to backtracking regular expression engines like those used in PCRE, Perl, and Python. It is a C++ library."
novm,"Experimental KVM-based VMM for containers, written in Go."
Idris-dev,A Dependently Typed Functional Programming Language
error-prone,Catch common Java mistakes as compile-time errors
blockly-games,Games for tomorrow's programmers.
gjstest,A fast javascript unit testing framework that runs on the V8 engine.
redgrep,♥ Janusz Brzozowski
refr,A framework for building reranking models.
infact,Provides a lightweight interpreter and factory for dynamically creating C++ objects at runtime.
angle,"A conformant OpenGL ES implementation for Windows, Mac, Linux, iOS and Android."
hat-backup,Backend-agnostic snapshotting backup system
leveldb,LevelDB is a fast key-value storage library written at Google that provides an ordered mapping from string keys to string values.
error-prone-javac,A mirror of the OpenJDK langtools repository
libaddressinput,"Google’s postal address library, powering Android and Chromium"
sanitizers,"AddressSanitizer, ThreadSanitizer, MemorySanitizer"
syzygy,Syzygy Transformation Toolchain
retrofit,"Type-safe REST client for Android and Java by Square, Inc."
open-vcdiff,An encoder/decoder for the VCDIFF (RFC3284) format
pageloader,A framework for creating page objects for in-browser or WebDriver tests.
pull-request-mailer,Sends a GitHub pull request as a patch series via email
identity-toolkit-java-client,Google Identity Toolkit client library for Java
identity-toolkit-python-client,Google Identity Toolkit client library for Python
identity-toolkit-php-client,Google Identity Toolkit client library for PHP
identity-toolkit-ruby-client,Google Identity Toolkit client library for Ruby
transitfeed,"A Python library for reading, validating, and writing transit schedule information in the GTFS format."
serialization.dart,A serialization library for Dart.
ldpush,A cross-vendor network device configuration distribution tool
mathfu,C++ math library developed primarily for games focused on simplicity and efficiency.
uribeacon,The Web Uri Open Beacon for the Internet of Things
identity-toolkit-go-client,Google identity Toolkit client library for Go
open-location-code,"Open Location Code is a library to generate short codes, called ""plus codes"", that can be used as digital addresses where street addresses don't exist."
lovefield,"Lovefield is a relational database for web apps. Written in JavaScript, works cross-browser. Provides SQL-like APIs that are fast, safe, and easy to use."
recaptcha,"PHP client library for reCAPTCHA, a free service to protect your website from spam and abuse."
physical-web,The Physical Web: walk up and use anything
vogon,Scalable customization of video campaigns
cap-library,Common Alerting Protocol Library
end-to-end,"End-To-End is a crypto library to encrypt, decrypt, digital sign, and verify signed messages (implementing OpenPGP)"
thread-weaver,A Java framework for testing multithreaded code.
google-authenticator-android,Open source fork of the Google Authenticator Android app
google-authenticator,Open source version of Google Authenticator (except the Android app)
material-design-icons,Material Design icons by Google
brotli,Brotli compression format
santa,A binary authorization system for macOS
ashier,Automating Terminal Interactions with Templates
github-issue-mover,Making it easy to migrate issues between repos.
codemirror.dart,A Dart wrapper around the CodeMirror text editor.
stenographer,"Stenographer is a packet capture solution which aims to quickly spool all packets to disk, then provide simple, fast access to subsets of those packets.  Discussion/announcements at stenographer@googlegroups.com"
fplutil,fplutil is a set of small libraries and tools that can be useful when developing applications for Android and other platforms.
universal-dash-transmuxer,UDT (Dash Transmuxer) Project: Can transmux DASH -> HLS or other formats.
cauliflowervest,"App Engine-based escrow solution for enterprise management of disk encryption technologies for OS X (FileVault 2), Windows (BitLocker), and Linux (LUKS)."
rappor,RAPPOR: Privacy-Preserving Reporting Algorithms
personfinder,Person Finder is a searchable missing person database written in Python and hosted on App Engine.
double-conversion,Efficient binary-decimal and decimal-binary conversion routines for IEEE doubles.
rich-test-results,Understand a test failure
nogotofail,An on-path blackbox network traffic security testing tool
search-samples,Sample code for integrating with Search.
identity-toolkit-node-client,Google Identity Toolkit client library for Node.js
pienoon,Multiplayer party game where you can throw pies at your friends.
chaps-linux,PKCS#11 Implementation for Linux
pkcs11test,PKCS#11 Test Suite
vim-syncopate,Make it easy to share beautiful code.  DISCLAIMER: This is not an official Google product.
acai,Testing library for JUnit4 and Guice.
ioweb2015,I/O Web App 2015
libphonenumber,"Google's common Java, C++ and JavaScript library for parsing, formatting, and validating international phone numbers."
todo-tracks,Web dashboard for tracking the TODOs in a Git repo
TouchTime,Tells the time through vibration patterns on an Android smartwatch.
google-api-javascript-client,"Google APIs Client Library for browser JavaScript, aka gapi."
rysim,RySim is a set of implementations of a simple SEIR simulation system
tuneup.dart,A command-line tool to manipulate and inspect your Dart projects.
beacon-platform,Code samples for Google's beacon platform
shaka-player,JavaScript player library / DASH & HLS client / MSE-EME player
rowhammer-test,Test DRAM for bit flips caused by the rowhammer problem
file-system-stress-testing,A tool that can be used to stress test POSIX filesystems.
material-design-lite,Material Design Components in HTML/CSS/JS
reflectable.dart,Reflectable is a Dart library that allows programmers to eliminate certain usages of dynamic reflection by specialization of reflective code to an equivalent implementation using only static techniques. The use of dynamic reflection is constrained in order to ensure that the specialized code can be generated and will have a reasonable size.
shipshape,Program analysis platform
google-drive-proxy,"Google Drive Proxy is a Windows service that provides a simpler interface to the Google Drive API for other applications. It transparently handles authentication, synchronization and managing a cache of downloaded files."
spatial-media,Specifications and tools for 360º video and spatial audio.
fonts,"Font files available from Google Fonts, and a public issue tracker for all things Google Fonts"
encrypted-bigquery-client,An experimental version of the BQ client which adds client-side encryption
box2d.dart,A Dart port of Java's Box2D libraries.
allocation-instrumenter,A Java agent that rewrites bytecode to instrument allocation sites
re2j,linear time regular expression matching in Java
or-tools,Google's Operations Research tools:
cloud-cup-android,Firebase Android client of the a multi device game
glog,C++ implementation of the Google logging module
comid,CodeMirror in Dart
cloud-print-connector,Google Cloud Print Connector
jscin,Automatically exported from code.google.com/p/jscin
keyczar,Easy-to-use crypto toolkit
zopfli,"Zopfli Compression Algorithm is a compression library programmed in C to perform very good, but slow, deflate or zlib compression."
gwt-charts,Automatically exported from code.google.com/p/gwt-charts
python_portpicker,A module to find available network ports for testing.
classp,Classp -- a classier way to parse
google-apputils,Please use https://github.com/abseil/abseil-py instead. This was auto-exported from code.google.com/p/google-apputils-python
reportlatency,Automatically exported from code.google.com/p/reportlatency
irrduino,Irrduino is an Arduino-based irrigation control system.
python-gflags,Python implementation of the Google commandline flags module.
jsontoken,Automatically exported from code.google.com/p/jsontoken
apis-client-generator,"The Google APIs Client Generator is a tool for generating client libraries for APIs based on the Google API Discovery format. It is based on the same core technology Google uses to publish their API libraries.  Current support is for C++, C#/.NET, Dart, Java, Java/GWT, and PHP."
nixysa,Automatically exported from code.google.com/p/nixysa
crush-tools,Automatically exported from code.google.com/p/crush-tools
gxui,An experimental Go cross platform UI library.
supersonic,"Supersonic is an ultra-fast, column oriented query engine library written in C++"
depan,"DepAn is a direct manipulation tool for visualization, analysis, and refactoring of dependencies in large applications."
ytstatistics-demo,Automatically exported from code.google.com/p/ytstatistics-demo
gopacket,Provides packet processing capabilities for Go
szl,A compiler and runtime for the Sawzall language
easy-gwt-mock,An EasyMock-like Mocking Framework for Google Web Toolkit
nfc-smart-tag,Automatically exported from code.google.com/p/nfc-smart-tag
password-alert,A Chrome Extension to help protect against phishing attacks.
gcm,Google Cloud Messaging - client libraries and sample implementations
yapf,A formatter for Python files
pytype,A static type analyzer for Python code
ipaddr-py,Google's Python IP address manipulation library
gson,A Java serialization/deserialization library to convert Java Objects into JSON and back
pub_cache,A library to reflect on the local pub cache.
cluster-scheduler-simulator,Automatically exported from code.google.com/p/cluster-scheduler-simulator
wwgc,"viewer profile generator for ""Works with Google Cardboard"""
hyou,Pythonic Interface to manipulate Google Spreadsheet.
santa-tracker-android,Ho Ho Ho
mozc-devices,Automatically exported from code.google.com/p/mozc-morse
hashing-demo,Sample implementation of a proposed C++ hashing framework
google-drive-shell-extension,Google Drive Shell Extension is a Shell Namespace Extension for Microsoft Windows. It creates a virtual folder on My Computer that allows the user to interact with his Google Drive account transparently through Windows Explorer.
osdetector-gradle-plugin,"A Gradle plugin that detects the OS name and architecture, providing a uniform classifier to be used in the names of native artifacts."
packetdrill,The official Google release of packetdrill
codesearch,"Fast, indexed regexp search over large file trees"
wicked-good-xpath,Pure JS implementation of the DOM Level 3 XPath specification
binplist,Binary property list (plist) parser
objectfilter,Automatically exported from code.google.com/p/objectfilter
CallBuilder,Make a Java builder by defining one function.
built_collection.dart,Immutable Dart collections via the builder pattern.
older-mirrored-patches,Google's older mirrored patches and tarballs that used to live at http://code.google.com/opensource/patches.html
pindrop,C++ cross-platform game audio library
gdata-java-client,Automatically exported from code.google.com/p/gdata-java-client
motive,"A cross-platform, memory efficient, and performant animation system written in C++"
UIforETW,User interface for recording and managing ETW traces
testimony,"Testimony is a single-machine, multi-process architecture for sharing AF_PACKET data across processes, allowsing packets to be copied from NICs into memory a single time, then shared across multiple processes."
protobuf-gradle-plugin,Protobuf Plugin for Gradle
archive-patcher,Automatically exported from code.google.com/p/archive-patcher
chrome-opt-out-extension,DEPRECATED: Keep My Opt-Outs. Replaced by Protect My Choices.
gtm-http-fetcher,Google Toolbox for Mac - HTTP Fetcher
gdata-objectivec-client,Google Data APIs Objective-C Client Library
gtm-oauth,Google Toolbox for Mac - OAuth Controllers
google-toolbox-for-mac,Google Toolbox for Mac
earthengine-api,Python and JavaScript bindings for calling the Earth Engine API.
mozc,Mozc - a Japanese Input Method Editor designed for multi-platform
json-sans-eval,Automatically exported from code.google.com/p/json-sans-eval
py-html-contextual-escaping,Automatically exported from code.google.com/p/py-html-contextual-escaping
vim-colorscheme-primary,"Primary, a Vim color scheme based on Google's colors"
password-sync-support-tool,Support tool for Password Sync for Google Workspace and Cloud Identity customers. Formerly GSPSTool.
windowtester,Automatically exported from code.google.com/p/windowtester
google-visualization-java,Automatically exported from code.google.com/p/google-visualization-java
google-visualization-python,Automatically exported from code.google.com/p/google-visualization-python
voter-info-tool,Automatically exported from code.google.com/p/voter-info-tool
webkit_inspection_protocol.dart,A client for the Webkit Inspection Protocol (WIP).
navc,C code indexer using language semantic from clang
honggfuzz,"Security oriented software fuzzer. Supports evolutionary, feedback-driven fuzzing based on code coverage (SW and HW based)"
MOE,Make Opensource Easy - tools for synchronizing repositories
google-java-format,Reformats Java source code to comply with Google Java Style.
gmail-oauth2-tools,Tools and sample code for authenticating to Gmail with OAuth2
service_worker.dart,An implementation of service workers in Dart
librato.dart,A Dart library to upload metrics data to librato.com.
MOE-py,A system for synchronizing repositories
nsjail,"A light-weight process isolation tool, making use of Linux namespaces and seccomp-bpf syscall filters (with help of the kafel bpf language)"
caliper,Micro-benchmarking library for Java
watchpresenter,Pass your slides on Google Drive using your phone or watch
styleguide,Style guides for Google-originated open-source projects
zooshi,Multi-platform game where you feed well dressed animals with sushi
gojiraw,GO JIffy-fast RAW-draw
shlex,Automatically exported from code.google.com/p/go-shlex
sensei,Logistic regression engine for medium-sized data
emoji4unicode,Automatically exported from code.google.com/p/emoji4unicode
contentbox,"Distribution of social and virtual content with an open and collaborative educational environment, available to communities around the world in one place, with a standard format and quality"
java-sourcetools,Automatically exported from code.google.com/p/java-sourcetools
blkcgroup,Automatically exported from code.google.com/p/blkcgroup
io-captions-gadget,Automatically exported from code.google.com/p/io-captions-gadget
keytransparency,A transparent and secure way to look up public keys.
