name,description
c9-python-getting-started,Sample code for Channel 9 Python for Beginners course
jschema-to-python,Generate source code for a set of Python classes from a JSON schema.
CromwellOnAzure,Microsoft Genomics supported implementation of the Broad Institute's Cromwell workflow engine on Azure
GuestConfigurationProject,A community supported Plaster template to scaffold projects for custom Azure Policy Guest Configuration resources/configurations
Partner-Center-Payout-APIs,Sample code for using the Partner Center Payout APIs
bandit-sarif-formatter,A report formatter for Bandit (a Python security analyzer) that produces output in the SARIF format.
appcenter-rest-python,A minimal Python wrapper around the App Center REST API
MicrosoftDefenderForEndpoint-PowerBI,A repo for sample MDATP Power BI Templates
Uganda-Tanzania-Building-Footprints,Open dataset of machine extracted buildings in Uganda and Tanzania
Deploy-and-Optimize-Azure-ExpressRoute-Private-Peering,"This deployment guide is focused on helping you deploy and optimize the Azure private peering, which enables connectivity between your private network and your Azure VNets over ExpressRoute."
sarif-python-om,Python classes for the SARIF object model
EMNLP2019-Adjective-Knowledge-for-Text-to-SQL,"Source code for EMNLP2019 paper ""Leveraging Adjective-Noun Phrasing Knowledge for Comparison Relation Prediction in Text-to-SQL""."
deploy-MLmodels-on-iotedge,This repository shows how to deploy machine learning models on Azure IoT Edge. 
CSEDevOps,Azure DevOps extensions from CSE DevOps team
PSRule-pipelines,Validate infrastructure as code (IaC) and DevOps repositories using Azure Pipelines.
Icebreaker,"This is the demo code associated with the paper: W. Gong , S. Tschiatschek, S. Nowozin, R.E. Turner, J.M. Hernández-Lobato, C.Zhang Icebreaker: Efficient Information Acquisition with Active Learning Conference on Neural Information Processing Systems  (NeurIPS 2019)"
AzureDiagnostics,AzureDiagnostics is a place for SMEs to host the Code Snippets / Quick Troubleshooting steps.
solution-accelerator-containerized-store,This accelerator was built to provide developers with all of the resources needed to quickly build a vending kiosk prototype with Azure Custom Vision. Use this accelerator to jump start your development efforts with your own data or as a learning tool to better understand how Custom Vision AI can be transformative for frictionless inventory.
psadxanalysis,PowerShell module for Azure Data Explorer telemetry analysis using analysis pack format.
azure-iot-edge-cv-model-samples,An end-to-end IoT Edge solution performing object detection (YOLOv3)
DiceWeb,"Sample apps, games and other content for use in testing the Microsoft Partner Center."
azure-spring-cloud-training,Guides and tutorials to make the most out of Azure Spring Cloud 
devices-hardware-dev-center-manager,Class library used in invoking HTTP requests to the Hardware Dev Center dashboard API
Msdyn365.Commerce.Online,Dynamics 365 Commerce online project
BotFramework-WeChat,WeChat Adapter for BotFramework
msgraph-edu-sample,Showcase Microsoft Graph in a real-world application.
pxt-minecraft-HOC2019,Extension to Hour of Code experience in Minecraft
winmd,C++ winmd parser
DMXInspector,The DMX Inspector is an Arduino-based device that will read out the data being sent on a DMX512 universe. This provides a developer of DMX control software and/or an author of sequences with a desktop debugging display that confirms the data being sent to the lighting without having to actually be connected to a universe of DMX devices.
Reactors,Content for Microsoft Reactor Workshops
hackwithazure,Resources for students at hackathons
XboxGameBarSamples,Sample code for Xbox Game Bar Widgets
electionguard-dotnet,"This repository implements the ElectionGuard API using C#. It includes all major functions of the ElectionGuard SDK, including key ceremony, ballot encryption, encrypted ballot tally, and partial decryptions for knowledge proofs of trustees. "
ignite-learning-paths-training-afun,"Microsoft Ignite Learning Path, Train the Trainer materials: Azure Fundamentals"
ignite-learning-paths-training-aiml,"Microsoft Ignite Learning Path, Train the Trainer materials: Developers Guide to AI"
ignite-learning-paths-training-apps,"Microsoft Ignite Learning Path, Train the Trainer materials: Developing Cloud Native Applications"
ignite-learning-paths-training-mco,"Microsoft Ignite Learning Path, Train the Trainer materials: Managing Cloud Operations"
ignite-learning-paths-training-msi,"Microsoft Ignite Learning Path, Train the Trainer materials: Migrating Server Infrastructure "
ignite-learning-paths-training-mod,"Microsoft Ignite Learning Path, Train the Trainer materials: Modernizing Web Applications and Data"
ignite-learning-paths-training-ops,"Microsoft Ignite Learning Path, Train the Trainer materials: Improving Reliability through Modern Operations Practices"
CsWinRT,C# language projection for the Windows Runtime
glue,"GLUE is a lightweight, Python-based collection of scripts to support you at succeeding with speech and text use-cases based on Microsoft Azure Cognitive Services."
five-dollar-genome-analysis-pipeline-azure,Workflows used for germline short variant discovery in WGS data - replaced by https://github.com/microsoft/gatk4-genome-processing-pipeline-azure
ApplicationInspector,A source code analyzer built for surfacing features of interest and other characteristics to answer the question 'What's in the code?' quickly using static analysis with a json based rules engine. Ideal for scanning components before use or detecting feature level changes.
banner-settings-ado-extension,Banner Settings provides a settings pane under Organization Settings to allow Project Collection Administrators to show sitewide banners. Alert your Azure DevOps users to upcoming changes or events without sending out mass emails. Compatible with Azure DevOps Services and Server.
hcnproxyctrl,Lightweight utility tool built on hcsshim for managing hcn proxy policy
IBAC-SNI,"Code to reproduce the NeurIPS 2019 paper ""Generalization in Reinforcement Learning with Selective Noise Injection and Information Bottleneck"" by Maximilian Igl, Kamil Ciosek, Yingzhen Li, Sebastian Tschiatschek, Cheng Zhang, Sam Devlin and Katja Hofmann."
tempeh,tempeh is a framework to TEst Machine learning PErformance exHaustively which includes tracking memory usage and run time.
k12,Content for K-12 educators interested in using Azure with their students.
MSSQL_SSISWorkshop,SSIS Workshop Intent to take People from Beginner to Intermediate Level
TypeScriptWinMD,A tool to generate TypeScript definition files from Windows Metadata files (WinMD)
iomt-fhir,iomt-fhir
kestrel-inline-sockets,ASP.NET Core Kestrel server extension to enable synchronous response write operations safely.
sarif-tutorials,User-friendly documentation for the SARIF file format.
health-data-sync,HealthDataSync is a Swift library that simplifies and automates the export of HealthKit data to an external store.
2019-ignite-circuit-playground,Get started with Circuit Playground Express and the Device Simulator Express
healthkit-to-fhir,The HealthKitToFhir Swift Library provides a simple way to create FHIR Resources from HKObjects.
iomt-fhir-client,The IomtFhirClient Swift library simplifies sending IoMT (Internet of Medical Things) data to an IoMT FHIR Connector for Azure endpoint.
healthkit-on-fhir,HealthKitOnFhir is a Swift library that automates the export of Apple HealthKit Data to a FHIR Server.
lets-talk-mental-health,Let's Talk---A mental health app. Collaborative project with Microsoft Research India and National Institute of Mental Health and Neurosciences (NIMHANS)
ReverseDNSGeolocation,Reverse DNS Geolocation - Determine location of routers from their reverse DNS hostnames
Asynchronous_impulse_response_measurement,Sample code for acoustic impulse response estimation without clock synchronization
vs-pty.net,Fork pseudoterminals in C#
MT-DNN,Multi-Task Deep Neural Networks for Natural Language Understanding
vscode-codicons,The icon font for Visual Studio Code
MRDL_Unity_Surfaces,Touchable surfaces for Hololens and Immersive headset
logrl,Logarithmic Reinforcement Learning
bono,Quantum visualizer 
Kuku,Kuku is a compact and convenient cuckoo hashing library written in C++.
belugasounds,Using machine learning to detect beluga whale calls in hydrophone recordings
Perceptual_saliency_of_early_reflections,Model for selecting perceptually relevant early reflections for parametric spatial sound rendering
TestWinRT,WinRT test component
continuity,A platform that makes it easy to blend react-native components into your native application.
Recursive-Cascaded-Networks,[ICCV 2019] Recursive Cascaded Networks for Unsupervised Medical Image Registration
RockPaperScissorsLizardSpock,"Rock, Paper, Scissors, Lizard, Spock - Sample Application"
opentelemetry-azure-monitor-python,This repository is the home to Azure Monitor SDKs and exporters utilizing the OpenTelemetry Python Client https://github.com/open-telemetry/opentelemetry-python to send telemetry data to Azure Monitor written in Python.
Peregrine,"Peregrine is a workload optimization platform for cloud query engines. The goal of Peregrine is three-fold: 1. make it easier to ingest and analyze query workload telemetry into a common engine-agnostic representation,  2. help developers to quickly build workload optimization applications to reduce overall costs and improve operational efficiency, and  3. providing better experience to the customers in the form of workload insights, actionable recommendations, and self-tuning capabilities."
pxt-maker-controller,Build custom MakeCode Arcade controllers
vscode-gradle,"Manage Gradle Projects, run Gradle tasks and provide better Gradle file authoring experience in VS Code"
macaw,An Extensible Conversational Information Seeking Platform
windows-container-tools,Collection of tools to improve the Windows Containers experience 
AzureNL,Reusable samples of all sorts
experimental-pcf-control-assets,Holds assets for an experimental pcf control
homebrew-azdata-cli-release,The Mac homebrew tap for maintaining a stable work environment for azdata-cli 
vscode-deploy-azure,"VS code extension: Deploy To Azure, which helps set up CI/CD for deployment to Azure Resources."
variable-substitution,Enable GitHub developers to parameterize the values in their config files from a GitHub Action workflow
MSGraphNotifications,Docs and sample code for the new Microsoft Graph notifications client SDK
FluentDarkModeKit,A library for backporting Dark Mode in iOS
FluidFrameworkTestData,Test data for microsoft/FluidFramework repo
vscodespaces-quickstart,A simple Node.js app to support Visual Studio Codespaces quickstart documentation.
msquic,"Cross-platform, C implementation of the IETF QUIC protocol."
azure-pipelines-evaluate-artifact-policies,Repository that contains code related to artifact policy evaluation to be used in azure pipelines
Commercial-Marketplace,This project provides Partners and Startups with code samples and guidance to help build Commercial Marketplace offers.  This project complements the Commercial Marketplace (Azure and AppSource) publishing guide : https://docs.microsoft.com/en-us/azure/marketplace/marketplace-publishers-guide
Test-NetStack,"This tool tests the native, synthetic, and hardware network data path"
tdqn,Template-DQN and DRRN agent implementations
datascience4managers,"Generalization, Utility, and Experimentation: ML Concepts for Making Better Business Decisions"
ai-utilities,SAMPLE: Microsoft AI Azure Machine Learning Utilities and Wrappers.
customvision-tfjs,NPM package for TensorFlow.js models exported from Custom Vision Service
trsp,Technician Routing and Scheduling Problem
Analysis-Framework-for-TVM,Static analysis framework for analyzing programs written in TVM's Relay IR.
Microsoft-Rocket-Video-Analytics-Platform,A highly extensible software stack to empower everyone to build practical real-world live video analytics applications for object detection and counting with cutting edge machine learning algorithms.
VirtualHealthcareBlueprint,Setup Healthcare Bot landscape to provide organizations with Virtual Health Assistants
react-native-lazy-index,"RAM bundle friendly, bundle-time generated `index.js`"
coyote-samples,Get started with Coyote with these simple introductory sample projects.
AFUN-Demos,Demos for AFUN content for Microsoft Ignite the Tour content 
startups,"Guidance, information, and resources to get your startup up and running on Azure"
Azure-RACI-Toolkit,The purpose of this RACI is to provide a foundation for organizations beginning the journey into Microsoft Azure. It contains common tasks across both governance and operations that organizations should identify owners and operators for.
checkedc-automation,Scripts for automated testing of the Checked C clang compiler.
AirSim-Drone-Racing-VAE-Imitation,"Code associated with our paper ""Learning Visuomotor Policies for Aerial Navigation Using Cross-Modal Representations"": https://arxiv.org/abs/1909.06993"
IRNet,An algorithm for cross-domain NL2SQL 
TailwindTraders-ShippingManagement,Power App + Azure. Serverless Demo.
PowerApps-Azure-Lab,Repository to host the PowerApps Azure Lab
nutter,Testing framework for Databricks notebooks
vscode-pwa-analyzer,Log viewer for https://github.com/microsoft/vscode-pwa
DynamicProto-JS,"Generates dynamic prototype methods for JavaScript objects (classes) by supporting method definition within their ""class"" constructor (like an instance version), this removes the need to expose internal properties on the instance (this) which results in better code minfication and therefore improved load times for your users."
BizApps-ISV-Engagement,"BizApps ISV Engagement : We enable ISVs, SIs and partners to develop and build solutions on top of Business Application and Intelligence platform."
Industry-Accelerator-Media,"Dynamics 365 is releasing Industry Accelerators to enable ISVs, SIs and Partners to rapidly build industry focused solutions on top of our Business Application and Intelligence Platforms. These accelerators are created through a close partnership with internal Product , Sales, Service, Marketing, Field and Vertical Teams, with feedback from external industry SI, ISV and Partners. Here you will find samples and guidance on how to build and extend your industry solution on the Dynamics 365 Business Application and Intelligence platforms using our industry accelerators. Samples will also include cross product implementations with Azure, Office 365, Power BI, LinkedIn, Teams and other on-premise and cloud based implementations."
pytorch-luxor-lab,"""Solving problems with Deep Learning: an in-depth example using PyTorch and its ecosystem"" tutorial/lab"
tilecode,"Design, Code and Play Games on MakeCode Arcade Devices"
electionguard-admin-device,"Admin Device to administer ElectionGuard election processes, including key generation, trustee provisioning, and post-election tallying, partial decryptions, and zero-knowledge proofs"
electionguard-ballot-box,"Smart Ballot Box software that scans ballots to generate lists of cast and spoiled ballots in an election; used in tallying to finalize ballot operations (cast or spoil, etc.) for publishing results"
electionguard-tracking-site,Web app and functions to upload and publish ElectionGuard end-to-end verifiable election artifacts for election verifiers and tracking ID verification
EVM-for-CCF,Sample EVM application for CCF
Personalizer-WordPress,WordPress plugin for Azure Cognitive Service Personalizer
adx-query-charts,Draw charts from Azure Data Explorer queries
iotedge-k8s-doc,Docs mini-site for IoT Edge on Kubernetes
vscode-minimist,parse argument options
electionguard-api-python,"ElectionGuard Web API in python to demonstrate usage of electionguard-python in performing ballot encryption, casting, spoiling, and tallying."
framer-x-fabric-ui,Fabric UI package for Framer X
Distilled-Sentence-Embedding,Scalable Attentive Sentence-Pair Modeling via Distilled Sentence Embedding (AAAI 2020) - PyTorch Implementation
BuildUpToDateChecker,Performs a fast check of MSBuild projects to see if they are up to date or if they require a rebuild. This helps locate overbuilding scenarios.
pxt-scarf,MakeCode powered scarf
BCUpgrade,Unofficial Documentation on how to upgrade to the latest version of Business Central
playwright,"Playwright is a framework for Web Testing and Automation. It allows testing Chromium, Firefox and WebKit with a single API. "
rnx-kit,"Tools which help developers build, deliver, and maintain React Native apps and libraries."
TokenReplace,A simple example of how to perform a token search/replace within files by using a GitHub build action.
platformer-ml-game,Edutainment game teaching players concepts around machine learning
FeaturizersLibrary,"A library of cross-platform, cross-framework, cross-programming language featurizers (operations in a data processing pipeline) that can be used during Machine Learning training and prediction activities."
DataOps,Example code for doing DataOps
MTC_TeamsGuestAccess,Teams Guest Access Solution
MCSBusinessApplicationsDynamicsFSUtilityIndustry,Industry Accelerator for Dynamics FS and SAP Utility workloads 
2D-TAN,AAAI‘20 - Learning 2D Temporal Localization Networks for Moment Localization with Natural Language
MS-Lumos,"Tools to compare metrics between datasets, accounting for population differences and invariant features."
vscode-figma-toolkit, A Figma design toolkit for Visual Studio Code
cds-management-api-node,Online Management API for Common Data Service for Node.js
cognitive-services-speech-sdk-go,Go bindings for the Microsoft Cognitive Services Speech SDK
oac-explore,"Code accompanying the paper ""Better Exploration with Optimistic Actor Critic"" (NeurIPS 2019)"
pxt-kickoff,A Football game engine for MakeCode Arcade
25-days-of-serverless,Repository responsible for 25 days of Serverless challenges
MTP-AHQ,DEPRECATED -> GO TO https://github.com/microsoft/Microsoft-threat-protection-Hunting-Queries
botframework-telephony,Bot Framework Telephony
PSRule.Monitor,Log PSRule analysis results to Azure Monitor.
vcperf,A build analysis tool for the MSVC toolchain.
MTC_AzurePolicySamples,MTC Azure Policy Samples
spatialaudio-unity,"This repository provides plugins, tools and samples for integrating spatial audio and acoustics into your Unity 3D applications and games."
TypeScript-repos-automation,Shared JS infra for automation across repos owned by the TypeScript team
Microsoft.Unity.Analyzers,Roslyn analyzers for Unity game developers
react-native-dualscreen,React Native Dual screen module
TeamCloud,Enable enterprise development teams to create secure compliant cloud development environments.
TeamCloud-Providers,Providers for TeamCloud.
AccountGuard,Security ARM Templates for AccountGuard Enrollees 
pxt-radio-firefly,A firefly-like protocol for MakeCode radio
MixedReality-Unreal-Samples,A collection of mixed reality samples built with Unreal Engine 4
TailwindTraders-PointOfSale,Tailwind Traders - Point of Sale Legacy Migration to Microsoft Azure
pxt-microbit-buttons,Advanced support for micro:bit buttons in MakeCode
MCW-Hybrid-identity,MCW Hybrid identity
appcenter-Xamarin.UITest-Demo,Minimal App for demonstrating Xamarin.UITest functionality within App Center
mouselog,"🐾 A web-based tool for logging, visualizing and analyzing mouse events like movement and clicks. "
AnanthaRekha,Generates varieties of images of randomized but semantically correct technical diagrams like flow charts and state diagrams. These images can be used to train NNs that perform image segmentation tasks.
tensorflow-rematerialization,Implementation of a Tensorflow XLA rematerialization pass
SuperchargeAzureSQLDeployments,"Learn how to quickly deploy and mange Azure SQL database development and deployments at scale using Azure DevOps Services.  Supercharge your data estate with database lifecycle management using modern cloud principles and architectures.  Learn how to leverage the power of Azure Resource Manager and DevOps to deploy efficiently. Empower your customers to seamlessly manage database projects, and handle schema changes that will avail their cloud migration efforts with ease.  "
appcenter-Xamarin.Forms-Gallery-Demo,"Demonstration based on this sample, to show how different UI elements can be tested with App Center: https://github.com/xamarin/xamarin-forms-samples/tree/master/FormsGallery"
OCR-Form-Tools,A set of tools to use in Microsoft Azure Form Recognizer and OCR services.
migrate-java-ee-app-to-azure-training,Learn how to migrate an existing Java EE app to Azure
PSRule.Rules.CAF,A suite of rules to validate Azure resources against the Cloud Adoption Framework (CAF) using PSRule.
PixelDefend,Source Code for ICRL 2018 Paper:  PixelDefend: Leveraging Generative Models to Understand and Defend against Adversarial Examples
conversationlearner,Contains all packages for running ConversationLearner bots.
sqlmanagementobjects,"Sql Management Objects, an API for scripting and managing SQL Server and Azure SQL Database"
Spartan,Spartan: High-speed zkSNARKs without trusted setup
bing-commerce-sdk-for-python,Bing for Commerce Python SDK
Azure-DevOps-YAML-for-Unity,A sample yaml configuration for creating a headless pipeline to build Unity3D projects for HoloLens2 with Azure Pipelines and Microsoft Hosted Agents.
PSRule.Requirements,Use PowerShell PSRule and Requirements together.
winrtc,"The WinRTC project hosts everything needed to build apps with interoperable real time communications for modern Windows. It brings the power of WebRTC to modern Windows apps written in C#, C++ and VB. WinRTC enables real-time voice calling, video chat and data functionality (file transfer etc.) with web browsers via WebRTC."
bing-commerce-sdk-for-net,Bing for Commerce SDK for dot net
maro,Multi-Agent Resource Optimization (MARO) platform is an instance of Reinforcement Learning as a Service (RaaS) for real-world resource optimization problems. 
android-app-size-diff,Android app size measuring in your CI
bing-commerce,"Bing for Commerce main repository, containing swaggers, documentation, and others."
hivedscheduler,Kubernetes Scheduler for Deep Learning
openpai-runtime,Runtime for deep learning workload
openpaimarketplace,A marketplace which stores examples and job templates of openpai. Users could use openpaimarketplace to share their jobs or run-and-learn others' sharing job.
openpaisdk,OpenPAI SDK
openpaivscode,"Extension to connect OpenPAI clusters, submit AI jobs, simulate jobs locally, manage files, and so on."
presidio-research,"This package features data-science related tasks for developing new recognizers for Presidio. It is used for the evaluation of the entire system, as well as for evaluating specific PII recognizers or PII detection models."
Template-apps-examples,Power BI template apps examples
m365-hrconnector-sample-scripts,Includes the scripts to upload the data to the hr connector jobs configured on m365.
art,"Exploring the connections between artworks with deep ""Visual Analogies"""
ServiceFabricDSC,Desired State Configuration module for Service Fabric
workshop-tonkotsu-nodejs,GitHub Openhack 
Tools-for-Health-Data-Anonymization,Set of tools for helping with data (in FHIR format) anonymization.
Microsoft-OpenXR-Unreal,An Unreal Engine game plugin providing additional features available on Microsoft's Mixed Reality devices like the HoloLens 2 when using OpenXR.
D3D12TranslationLayer,A library containing utilities for mapping higher-level graphics work to D3D12
D3D11On12,The Direct3D11-On-12 mapping layer
P.808,"This is an open-source implementation of the ITU P.808 standard for ""Subjective evaluation of speech quality with a crowdsourcing approach"" (see https://www.itu.int/rec/T-REC-P.808/en). It uses Amazon Mechanical Turk as the crowdsourcing platform. It includes implementations for Absolute Category Rating (ACR), Degradation Category Rating (DCR), and Comparison Category Rating (CCR). "
surface-duo-sdk-samples,Samples for Surface Duo SDK
DNS-Challenge,"This repo contains the scripts, models, and required files for the Deep Noise Suppression (DNS) Challenge.  "
msmarco,website for MS Marco
eventtracing-processing,Issues for the Microsoft.Windows.EventTracing.Processing.All NuGet package
DevDay2020KeynoteDemoWeb,DevDay2020KeynoteDemoWeb
DevDay2020KeynoteDemoXamarin,DevDay2020KeynoteDemoXamarin
DevDay2020KeynoteDemoAndroid,DevDay2020KeynoteDemoAndroid
vscode-dapr,A Visual Studio Code extension for Dapr development
DevDay2020KeynoteDemoUWP,DevDay2020KeynoteDemoUWP
debugpy,An implementation of the Debug Adapter Protocol for Python
AzureADDSC,DSC PowerShell module for AzureAD
affectbased,Affect-based Intrinsic Rewards for Learning General Representations: https://arxiv.org/abs/1912.00403
ignite-learning-paths-training-data,"Microsoft Ignite Learning Path, Train the Trainer materials: Modern Data Warehouse (Data)"
react-native-test-app,react-native-test-app provides a test app for all supported platforms as a package
MixedReality-UXTools-Unreal,UX tools and components for developing Mixed Reality applications in UE4. 
surface-duo-sdk-xamarin-samples,Xamarin Samples for Surface Duo SDK
GRTr,Generative Retrieval Transformer
LeadingConversationalSearchbySuggestingUsefulQuestions,WebConf 2020  paper Leading Conversational Search by Suggesting Useful Questions
LabanotationSuite,Microsoft Applied Robotics Research Library: LabanotationSuite - open source software tools to give service robots the ability to perform human-like gestures
playwright-dotnet,.NET version of the Playwright testing and automation library.
