name,description
Quantum,Microsoft Quantum Development Kit Samples
PSCredentialTools,PSCredential Tools provides varions methods for securly storing and retrieving credentials used in PowerShell scripts
AppCenter-Test-Espresso-Extensions,Extension library to run Espresso tests on Visual Studio App Center
AppCenter-Test-XCUITest-Extensions,Extension library to run XCUITest on Visual Studio App Center
AppCenter-Test-Appium-Java-Extensions,Extension library to run Appium Java tests on Visual Studio App Center
vscode-java-test,Run and debug Java test cases in Visual Studio Code.
gated-graph-neural-network-samples,Sample Code for Gated Graph Neural Networks
microsoft-iot-central-firmware,Sample firmware for Azure IoT Central [MOVED - see readme below]
pxt-gestures,A gesture recognition package for MakeCode - beta
Maps,A list of open source projects related to Microsoft's geospatial and mapping services.
ISLE,This repository provides code for SVD and Importance sampling-based algorithms for large scale topic modeling.
Product-flavor-dimension-sample-app,An implementation of a new inventory product flavor dimension.
graph-partition-neural-network-samples,Sample Code for Graph Partition Neural Networks
linux-vm-tools,Hyper-V Linux Guest VM Enhancements
ExploitProtectionConfiguration,Common configurations for Exploit Protection settings in Windows 10.
azure-linux-kernel,Patches for building an Azure-tuned Linux kernel.
tsyringe,Lightweight dependency injection container for JavaScript/TypeScript
DWScripter,DWScripter is a scripting tool for Analytics Platform System and Azure SQLDW. This Console app will script the ddl and dml for both APS and SQLDW.
PFE,Public repo for PFE projects
AzureSearch_JFK_Files,This repo contains the sample code of the Azure Search and Cognitive Services used to provide insights and analysis around the JFK Files.
Bing-Maps-Fleet-Tracker,"The Bing Maps Fleet Tracker is a tracking solution for small to medium sized teams. Easily track vehicles and mobile devices. Previously known as ""Project Hurghada""."
intelligent-apps,Activate Azure with Intelligent Apps. This solutions here proof of concepts to show how developers and architects can reimagine and add intelligent capabilities to enterprise applications using Azure Bot Framework and Cognitive Services. 
FederatedFBTroubleshooter,Troubleshooter script for Federation and F/B issues
glTF-Toolkit,A collection of tools for modifying and optimizing glTF assets
CodeTalk,Rethinking IDE accessibility
vscode-notepadplusplus-keybindings,Notepad++ Keybindings extension for VS Code
XboxConsole,Programmatically control your development Xbox One consoles.
deep_bait,Running the most popular deep learning frameworks on Azure Batch AI
ros_azure_iothub,This repository contains a ROS node for bidirectional communication with IoT Hub
node-spdlog,Spdlog bindings for Node.JS
vscjenkins-ci-scripts,CI scripts used by VS China Jenkins team
Elevation,End-to-end guide design for CRISPR/Cas9 with machine learning
SmartHotel360-Website,SmartHotel360 Webiste
SmartHotel360-Mobile,SmartHotel360 Mobile
SmartHotel360-Registration,SmartHotel360 - Registration (AKS with Windows Containers)
unitysetup.powershell,Powershell module for interfacing with Unity installs and projects.
service-fabric-explorer,Service Fabric Explorer is a web based dashboard for visualizing the state of a Service Fabric cluster.
AutonomousDrivingCookbook,"Scenarios, tutorials and demos for Autonomous Driving"
SmartHotel360-SentimentAnalysis,SmartHotel360 Sentiment Analysis App
Connect-keynote_AI_demos,This repo contains AI demos from recently concluded Connect() 2017 keynote demos!
slngen,Visual Studio solution generator
ros_azure_iothub-release,rosdeps repository for ros_azure_iothub
PQCrypto-SIKE,"This software is part of ""Supersingular Isogeny Key Encapsulation"", a submission to the NIST Post-Quantum Standardization project."
PQCrypto-LWEKE,FrodoKEM: Learning with Errors Key Encapsulation. FrodoKEM is a family of key-encapsulation mechanisms that are designed to be conservative yet practical post-quantum constructions whose security derives from cautious parameterizations of the well-studied learning with errors problem.
Cluster,PowerShell module for creating and managing Azure Resource Manager templates and deployments
azserialconsole,Azure Serial Console Docs
ml-server-text-classification,Text classification solution with Microsoft Machine Learning Server
ml-server-image-similarity,Image similarity solution with Microsoft Machine Learning Server
azure-nodejs-logpoints-docs,Instructions for setting up LogPoints on Azure
HealthBotPingTest,Write ping test for testing the HealthBot
pxt-brainpad,Microsoft MakeCode editor for the GHI Brainpad 
wineryjs,Winery.js: a framework for service experimentation
appcenter-sdk-android-breakpad,Fork of https://chromium.googlesource.com/breakpad/breakpad to be usable in https://github.com/Microsoft/AppCenter-SDK-Android test app without the fetch tools.
ptvsd,Python debugger package for use with Visual Studio and Visual Studio Code.
pxt-microturtle,A LOGO turtle library for micro:bit in MakeCode
scsmsendemail,SCSM SendEmail MP
scsmincidentsla,SCSM Incident SLA Management
scsmservicerequest,SCSM Service Request
scsmperftestharness,SCSM Perf Test Harness
vscode-iot-workbench,Azure IoT Device Workbench for Visual Studio Code
webperftoolbar,A drop-in toolbar to help visualize a website's performance.
QBASHER,Inverted file indexing and retrieval optimized for short texts.  Supports auto-suggest and query segment classification.
webhint-hints-microsoft,webhint rules for Microsoft websites
dynamics365f-o-custom-help,This repository contains code for helping you configure a custom help system for Microsoft Dynamics 365 Finance and Operations apps
SQLServerSpatialTools,"This project is a collection of tools for use with the spatial types in SQL Server. This project does not provide an end-user application, but rather a set of reusable functions which applications can make use of.  These functions may include data conversion routines, new transformations, aggregates, etc. Please feel free to suggest additional functionality.  This project is sponsored by Microsoft, but we welcome outside developers."
service-fabric-reverse-proxy,Service Fabric Reverse Proxy is an HTTP proxy for Service Fabric applications
scsmcopyobject,SCSM Copy Object
scsmcsvconnector,SCSM CSV Connector
smlets,SMLets - SCSM PowerShell Cmdlets
publishwi,Publishing SCSM Work Item to a Sharepoint Calendar
cognitive-services-notebooks,Interactive Jupyter notebooks for Microsoft Cognitive Services
vscode-spring-initializr,VSCode Extension for Spring Initializr
pxt-maker,"MakeCode target for ""Maker"" boards (beta)"
WorkflowManagerDSC,DSC Module for Workflow Manager
PowerBI-visuals-PowerKPI,Power KPI for Power BI
PowerBI-visuals-PowerKPIMatrix,A KPI matrix visualization sample for PowerBI
NativeKeras,Native implementation of a Keras-style API. Uses the Cognitive Toolking (CNTK) as backend.
SampleCPMProject,This sample project provides code snipets on how to call the REST api of the CPM service programmatically.
powerapps-tools,Unsupported PowerApps Tools & Apps
cs_comments_service,server side of the comment service
inno-updater,Helper utility to enable background updates for VS Code in Windows
azure-devops-python-samples,Python samples for interacting with and managing Azure DevOps
vscode-maven,"VSCode extension ""Maven for Java"""
azuredatastudio-postgresql,azuredatastudio-postgresql is an extension for Azure Data Studio that enables you to work with PostgreSQL databases
botbuilder-js,"Welcome to the Bot Framework SDK for JavaScript repository, which is the home for the libraries and packages that enable developers to build sophisticated bot applications using JavaScript. "
botbuilder-dotnet,"Welcome to the Bot Framework SDK for .NET repository, which is the home for the libraries and packages that enable developers to build sophisticated bot applications using .NET. "
botbuilder-java,"The Microsoft Bot Framework provides what you need to build and connect intelligent bots that interact naturally wherever your users are talking, from text/sms to Skype, Slack, Office 365 mail and other popular services."
botbuilder-python,"The Microsoft Bot Framework provides what you need to build and connect intelligent bots that interact naturally wherever your users are talking, from text/sms to Skype, Slack, Office 365 mail and other popular services."
adfsManagementTools,A collection of scripts and tools for managing ADFS
pxt-arcade,Arcade game editor based on Microsoft MakeCode
MPI.NET,MPI.NET updated for .NET Standard
sqlops-dataprotocolclient,Azure Data Studio Data Protocol Client
vscode-edge-debug2,This is a VS Code extension which helps you debug your JavaScript Code inside the Edge browser.
SecureDeviceConnectionProtocol,Secure Device Conneciton Protocol sample and documentation
xal,Xbox Live authentication library
ai-school-custom-vision-service-intro,This is an introduction to how to get started using the Custom Vision Service to generate custom models using the web interface and the SDK.
vscode-anaconda-extension-pack,Python extension pack for Anaconda
adfsOpenSource,Documentation and guidance for ADFS Open Source
TypeScript-Babel-Starter,"A sample setup using Babel CLI to build TypeScript code, and using TypeScript for type-checking. "
CDM,"The Common Data Model (CDM) is a standard and extensible collection of schemas (entities, attributes, relationships) that represents business concepts and activities with well-defined semantics, to facilitate data interoperability. Examples of entities include: Account, Contact, Lead, Opportunity, Product, etc."
PowerBI-Visuals-HorizontalBarChart,Power BI custom visual: a horizontal bar chart that saves space by putting the category labels inside the bars.
Quantum-NC,Microsoft Quantum Computing Libraries for noncommercial use
VSDebugAdapterHost,Visual Studio Debug Adapter Host
bingapi-hololens-demo,Demo project showcasing Bing API Adaptive Cards rendered on HoloLens via image recognition.
regexp-i18n,regular expression internationalization library
MentalHealthPlatform,A mental health platform that can be deployed for universities or companies
SpectrumDBClient,ETSI compliant PAWS client for connecting an LTE small cell to a TV White Space spectrum database
MSBuildSdks,MSBuild project SDKs
openvpn,Post-quantum Cryptography VPN (openvpn subproject)
openvpn-build,Post-quantum Cryptography VPN (openvpn-build subproject)
openvpn-gui,Post-quantum Cryptography VPN (openvpn-gui subproject)
fiddler-auth-sanitizer,Add-on for Telerik Fiddler to redact Authorization (and other) headers
spatial-computing,Samples showing how to use Azure and AI services in Mixed Reality projects
PQCrypto-VPN,Post-quantum Cryptography VPN
lis-rpm-build-pipeline,"RPM build script for lis-next, used for pipeline"
Unity-Xaml-Sample,Unity sample project showing a XAML webview and interaction with a Unity application.
UnityUWPBTLEPlugin,A sample plugin for use in Unity allowing access to BTLE features.
Unity-UWP-BTLE-Sample,A sample using the Unity UWP BTLE Plugin to access BTLE functions from within a unity application.
Partner-Center-Labs,Labs designed to help partners learn how to utilize the Partner Center API/SDK
appcenter-build-scripts-examples,A collection of build script examples to be used in the Build service of https://appcenter.ms
terraform-spring-boot,Spring Boot Starter for Terraform
EyeDrive,Drive with your eyes
skype-sync,Skype Sync SDK allows developers to easily create collaborative addins for Skype Interviews
devops-project-samples,Sample applications for Azure DevOps Project
vscode-markdown-tm-grammar,VS Code built-in markdown extension's Textmate grammar
WDD-Spring-2018,The Windows Developer Day Spring 2018 demo applications
VSSDK-Analyzers,Roslyn analyzers for Visual Studio extensions
PowerBI-visuals-outliers-det,"Find outliers in your data, using the most appropriate method and plot."
openshift-container-platform-playbooks,Playbooks for deploying OpenShift Container Platform in Azure
vscode-loc,VS Code Localization Extension
diskspd-for-linux,"A disk io load-generator and benchmarking tool for Linux, based on the Windows tool diskspd."
ALAppExtensions,Repository for collaboration on Microsoft AL application add-on and localization extensions for Microsoft Dynamics 365 Business Central.
botbuilder-tools,"Welcome to the Bot Framework Tools repository, which is the home for a set of tools for developers building bots with the Microsoft Bot Framework"
TrillSamples,Sample applications to demonstrate how to use the Trill library and API
Partner-Smart-Office,An open source toolkit empowering partners understand their customer’s security posture.
GaitAndBalanceApp,An application to measure Gait and Balance properties of humans using depth cameras
sarif-visualstudio-extension,SARIF Microsoft Visual Studio Viewer Extension
sarif-vscode-extension,SARIF Microsoft Visual Studio Code extension
jackknife-variational-inference,"Demonstration of Jackknife Variational Inference for Variational Autoencoders, related to ICLR 2018 paper."
qmt,Qubit Modeling Tools (QMT) for computational modeling of quantum devices
MCW-Microservices-architecture,MCW Microservices architecture
MCW-Serverless-architecture,MCW Serverless architecture
MCW-Continuous-delivery-in-Azure-DevOps,MCW Continuous delivery in Azure DevOps
MCW-Modern-cloud-apps,MCW Modern cloud apps
NETCoreWindowsServerConfig,ASP.NET Core Windows Server Hosting Configuration
WindowsServerContainerHostConfig,Example configuration for deploying and configuring a Windows Server Container Host.
powerbi-powershell,PowerShell community for Microsoft PowerBI. Here you will find resources and source for PowerShell modules targeting PowerBI.
vscode-docs-authoring,VSCode extension that provides markdown authoring assistance to docs.microsoft.com contributors
vscode-vs-keybindings,Visual Studio Keymap for Visual Studio Code
RangesOnMobile,Source code and data analysis scripts for a graphical perception study focusing on the visual display of quantitative ranges on mobile devices.
ax-2012-doc-tools,Repository of tools initially released with documentation with Microsoft Dynamics AX 2012 
pxt-ws2812b,A driver for WS2812B LEDs in MakeCode
2LCS,Lifecycle Services Companion App for administrators
pxt-radio-blockchain,A toy blockchain for the micro:bit radio and MakeCode
protool,A tool for working with Apple provisioning profiles
pxt-johnny-five,A sample MakeCode editor using Johnny Five
msix-packaging,MSIX SDK
mssql-server-ha,Contains source code for the mssql-server-ha package
tsdoc,A doc comment standard for TypeScript
Windows-Machine-Learning,Samples and Tools for Windows ML.
azure-cloudera-vm-metrics-logging,Azure Cloudera linux vm metrics logging with fluentd to azure storage
fast,The adaptive interface system for modern web experiences.
project-ruby-rails-container,Sample Ruby application targetting rails framework
FastTrack,GitHub home for Microsoft FastTrack
fasttrack-smat-workbook-generator,Generates a workbook from the output of the SMAT tool
ApplicationInsights-Profiler-AspNetCore,Application Insights Profiler sample and documentation
WindowsServerUpdateServicesConfig,Example containing Desired State Configuration script to demonstrate provisioning and configuring a WSUS instance.
XamarinUniversity-Samples,Mobile .NET and Azure samples for Xamarin University 
service-fabric,"Service Fabric is a distributed systems platform for packaging, deploying, and managing stateless and stateful distributed applications and containers at large scale."
CSE-Readiness,A collection of useful Readiness training resources
SimpleRemote,Simply automate a device under test via JSON-RPC.
service-fabric-client-dotnet,.NET client library for Service Fabric
activity-log-export-automation,Connect Splunk to Azure Activity Log via PowerShell automation
AzureStorageExplorer,"Easily manage the contents of your storage account with Azure Storage Explorer. Upload, download, and manage blobs, files, queues, tables, and Cosmos DB entities. Gain easy access to manage your virtual machine disks. Work with either Azure Resource Manager or classic storage accounts, plus manage and configure cross-origin resource sharing (CORS) rules."
ABAP-SDK-for-Azure,ABAP Libraries for SAP native Integration with Azure Services
uf2-nrf5,UF2 bootloader for NRF52840
rushjs.io-website,GitHub Pages website for https://rushjs.io 
api-extractor.com-website,GitHub Pages website for https://api-extractor.com
MCW-Template-Cloud-Workshop,Official Microsoft Cloud Workshop Template
MCW-Internet-of-Things,MCW Internet of Things
MCW-Intelligent-vending-machines,MCW Intelligent vending machines
MCW-Cloud-native-applications,MCW Cloud-native applications
ActiveDirectoryDSC.Reverse,ReverseDSC Orchestrator for ActiveDirectory
vmss-distribute-unique-certificates,Example Python / C# project that generates a unique certificate per Linux VM in a VM Scale Set and stores certs in KeyVault.
vscode-appcenter,App Center extension for VS Code
fluent-plugin-clouderametrics,Fluentd plugin for Cloudera metrics
Microsoft-365-Defender-Hunting-Queries,Sample queries for Advanced hunting in Microsoft 365 Defender
AnyContainer,Allows swapping out IoC containers without rewriting registration or resolve code.
PSRule,Validate infrastructure as code (IaC) and objects using PowerShell rules.
vscode-languageserver-protocol-foldingprovider,Proposed extension to the language server protocol: folding provider 
vscode-azureeventgrid,Azure Event Grid extension for VS Code
AKSDeploymentTutorial,Tutorial on how to deploy Deep Learning models on GPU enabled Kubernetes cluster
xbox-integrated-multiplayer-unity-plugin,Xbox Integrated Multiplayer (XIM) is a self-contained interface for easily adding multiplayer real-time networking and chat communication to your game through the power of Xbox Live services.
MCW-Lift-and-shift-Azure-Resource-Manager,MCW Lift and shift/Azure Resource Manager
MCW-Big-data-analytics-and-visualization,MCW Big data analytics and visualization
MCW-SQL-Server-hybrid-cloud,MCW SQL Server hybrid cloud
MCW-OSS-DevOps,MCW OSS DevOps
MCW-Intelligent-analytics,MCW Intelligent analytics
MCW-Enterprise-class-networking,MCW Enterprise-class networking in Azure
MCW-Enterprise-ready-cloud,MCW Enterprise-ready cloud
MCW-Building-a-resilient-IaaS-architecture,MCW Building a resilient IaaS architecture
MCW-App-modernization,MCW App modernization
MCW-Optimized-architecture,MCW Optimized architecture
MCW-Migrate-EDW-to-Azure-SQL-Data-Warehouse,MCW Migrate EDW to Azure SQL Data Warehouse
MCW-Migrating-Oracle-to-Azure-SQL-and-PostgreSQL,MCW Migrating Oracle to Azure SQL and PostgreSQL
MCW-Azure-security-and-management,MCW Azure security and management
MCW-SAP-NetWeaver-on-Azure,MCW SAP NetWeaver on Azure
MCW-OSS-PaaS-and-DevOps,MCW OSS PaaS and DevOps
MCW-Securing-PaaS,MCW Securing PaaS
MCW-Security-baseline-on-Azure,MCW Security baseline on Azure
MCW-Linux-lift-and-shift,MCW Linux lift and shift
MCW-SAP-HANA-on-Azure,MCW SAP HANA on Azure
MCW-IoT-and-the-Smart-City,MCW IoT and the Smart City
MCW-Mobile-app-innovation,MCW Mobile app innovation
MCW-Media-AI,MCW Media AI
MCW-Azure-Blockchain,MCW Azure Blockchain
skype-interviews-docs,Sample code showcasing how to use the Skype Interviews API 
appcenter-sampleapp-react-native,App Center Sample App for React Native
monaco-editor-webpack-plugin,Moved to https://github.com/microsoft/monaco-editor
PowerApps-Samples,"Sample code for Power Apps, including Dataverse, model-driven apps, canvas apps, Power Apps component framework, portals, and ai-builder."
containerized-microservices-pipeline,"Reference solution for Production micro-services pipeline built on VSTS, docker, kubernetes and full CI / CD pipeline."
inventory-hub-java-on-azure,"Sample Inventory Hub App using Serverless and Event-driven Java - on Azure with Spring Boot, Tomcat, Functions, Event Hub and Cosmos DB"
vscode-postgresql,PostgreSQL extension for VSCODE
powerbi-desktop-samples,Power BI Desktop sample files for the monthly release. Here you can find the PBIX files used in the monthly release videos.
Intune-Resource-Access,Sample code and scripts for interfacing with the Intune Resource Access APIs.
windows-admin-center-extension-template,This is the code template for an empty extension that you can use to start writing an extension using the Windows Admin Center (previously Project Honolulu) SDK.
windows-admin-center-sdk,SDK including documentation and sample code for developing extensions for Windows Admin Center (previously Project Honolulu)
Brokered-WinRT-Components,This repo contains samples demonstrating an enterprise-targeted feature supported by Windows 10 that allows UWP apps to use existing legacy code responsible for key business-critical operations.
pmwcas,pmwcas
winfile,Original Windows File Manager (winfile) with enhancements
schemy,A lightweight embeddable Scheme-like interpreter for configuration 
json-schemas,Microsoft Json-Schemas
PocketSkills,Mobile web application shell for educational content and interactive skill practices using a chat-like interface.
python-sample-vs-cpp-extension,This sample is the end product for the walkthrough on https://docs.microsoft.com/en-us/visualstudio/python/working-with-c-cpp-python-in-visual-studio
windows-dev-box-setup-scripts,Scripts to simplify setting up a Windows developer box
PowerBI-visuals-HeatStreams,A categorical heat-map of a metric over the time domain
PowerBI-visuals-TextFilter,Text Filter PowerBI Visualization
PowerBI-visuals-TimelineStoryteller,Timeline Storyteller PowerBI Visualization
PowerBI-visuals-CardBrowser,Card Browser PowerBI Visualization
Windows-Camera,Tools and samples for camera related APIs on Windows
TFSDemoGenerator,"A utility to help create projects on Visual Studio Team Foundation Server  with pre-populated sample content that includes source code, work items, iterations, service endpoints, build and release definitions based on a template you choose.  The purpose of this system is to simplify working with the hands-on-labs, demos and other education material provided by the Microsoft Visual Studio Marketing team. "
java-webapp-oidc-migrate-poc,"Demonstrates a pattern (using the adal4j library) for integrating Azure AD authentication with a legacy authentication system, and illustrating one approach to migrating users from the legacy auth system over to Azure AD."
IIS.Compression,Compression schemes for Microsoft IIS
vs-diagnostics-demo-recipe-app,App used to demonstrate various features in Visual Studio.
InventorySample,Sample UWP application for LOB scenarios
Windows-AppConsult-Blog,"Our blog posts and metadata, when released in markdown. "
Windows-AppConsult-Tools-DesktopBridgeRePack,Package/Unpackage easely your DesktopBridge Apps
Windows-AppConsult-samples-PWA,Progressive Web App sample code
IIS.Common,Common source and libraries used by IIS projects
spring-data-gremlin,We are in the process of deprecating Spring Data Gremlin. -- Provide generic annotation oriented programming form based on gremlin for graph database
AzureDevOpsDemoGenerator,"Azure DevOps Demo Generator helps teams create projects on their Team Services account with pre-populated sample content that includes source code, work items, iterations, service endpoints, build and release definitions based on a chosen template"
AppConsult-Samples-MixedReality,Samples code for building apps on the Windows Mixed Reality platform
Windows-AppConsult-Samples-DesktopBridge,"Build, package, test apps using Desktop Bridge. Code for MSIX applications"
fluent-plugin-application-insights,This is the fluentd output plugin for Azure Application Insights.
vscode-java-dependency,Manage Java projects in Visual Studio Code.
AX2012ARMTemplates,ARM deployment templates for AX 2012 R3 - High Availability Environments. 
openshift-rhsummit-lab,OpenShift for Red Hat Summit 2018 Lab
Windows-AppConsult-Tools-DesktopBridgeHelpers,Simple libraryto detect if a desktop application is running as classic Win32 or packaged with the Desktop Bridge
Windows-AppConsult-Tools-IAPWrapper,In-App-Purchase API-Wrapper for Desktop Bridge
fuse-webui,reusable React components built on Office UI Fabric React
python-sample-vs-learning-django,Sample code as created by following Django tutorials on docs.microsoft.com/visualstudio/python
Mobile-Chest-X-Ray-Analysis,This open source project contains source code to build a Xamarin iOS and Android mobile app. Once compiled the app can be used to analyze and interpret chest x-ray images. This experimental research project is used to supplement the release of the machine learning model (https://blogs.technet.microsoft.com/machinelearning/2018/03/07/using-microsoft-ai-to-build-a-lung-disease-prediction-model-using-chest-x-ray-images/).
Emoji2recipe,Recipe prediction model from emojis
spring-cloud-azure,Spring Cloud integration with Azure services 
pxt-mkdocs-sample,MkDocs documentation sample project that renders Microsoft MakeCode blocks
CorrelationVector-Go,CorrelationVector-Go provides a reference Go implementation of the CorrelationVector protocol for tracing and correlation of events through a distributed system.
CorrelationVector-CSharp,CorrelationVector-C# provides a reference C# implementation of the CorrelationVector protocol for tracing and correlation of events through a distributed system. 
gitbook-plugin-pxt,GitBook Plugin for rendering Microsoft MakeCode blocks
pxt-gitbook-sample,Sample Gitbook book that uses the PXT plugin to render Microsoft MakeCode blocks
