name,description
microbit-touchdevelop,The glue that binds together TouchDevelop programs compiled to C++ and the micro:bit runtime system
jojen,"Expressive validator for Node and the browser, with a small footprint and awesome performance"
unittest-cpp,A lightweight unit testing framework for C++
sails-hook-federalist-ms,Sails.js installable hook for Federalist (https://github.com/18f/federalist) to support Windows and Microsoft Azure.
DockerTools,"Tools For Docker, including Visual Studio Provisioning and Publishing"
azure-devops-intellij,IntelliJ IDEA plug-in for Visual Studio Team Services and Team Foundation Server (TFS)
WPFDXInterop,Repo for WPF DX Interop support
WindowsProtocolTestSuites,⭐⭐Join us at SNIA EMEA SDC SMB3 IO Lab 2021 (6/7-6/9): 
GSL,Guidelines Support Library
cordova-plugin-code-push,Cordova plugin for CodePush
tslint-microsoft-contrib,A set of TSLint rules used on some Microsoft projects.
ConcordExtensibilitySamples,Visual Studio Debug Engine Extensibility Samples
TACO,Tools for Apache Cordova
unityplugins,Unity Plugins for Windows Store and Azure related functions.
CodeAnalysis,Repo to hold GitHub landing page for Microsoft.github.io/CodeAnalysis
vscode-docs,Public documentation for Visual Studio Code
Windows-appsample-marble-maze,A 3D DirectX game for the Universal Windows Platform.
Azure-Services-Explorer,"Common component for IntelliJ, Android Studio and Eclipse plugin that allows developers to authenticate via Azure Active Directory and manage Azure resources"
Azure-Toolkit-for-IntelliJ,Azure Cloud tools for Java developers who use IntelliJ to develop applications hosted in Azure Cloud Services.
Microsoft-Cloud-Services-for-Android,"Plugin for easy and fast development of Android Apps connected to Azure Mobile Services, Notification Hub and Office 365 services. The plugin offers integrated development environment with these Microsoft Cloud services within IntelliJ IDEA and Android Studio."
vscode-languageserver-node,Language server protocol implementation for VSCode. This allows implementing language services in JS/TS running on node.js
vscode,Visual Studio Code
language-server-protocol,Defines a common protocol for language servers.
Multiverso,Parameter server framework for distributed machine learning
Windows-classic-samples,This repo contains samples that demonstrate the API used in Windows classic desktop applications.
Instance-Adapter-for-Microsoft-Dynamics-CRM,"An additional, non-Microsoft supported, adapter for use with Connector for Microsoft Dynamics that allows for the synchronization of data between two Microsoft Dynamics CRM 2011, 2013, or 2015 organizations.  The adapter allows for communication between two endpoints that exist on any authentication/hosting environment (on-premises, online, IFD, etc.)  This means that you can leverage this new adapter to move Microsoft Dynamics CRM 2011 or Dynamics CRM 2013 data between test and production servers or from on-premises to the cloud."
azure-shortcuts-for-java,A radically simplified API for Azure in Java - prototype
LightLDA,"Scalable, fast, and lightweight system for large-scale topic modeling"
mino,:chart_with_upwards_trend: Utility to run math on collections
Git-Credential-Manager-for-Windows,"Secure Git credential storage for Windows with support for Visual Studio Team Services, GitHub, and Bitbucket multi-factor authentication."
vscode-textmate,A library that helps tokenize text using Text Mate grammars.
compoundfilereader,A simple header file to read Microsoft compound file with minimal efforts.
vscode-editorconfig,[DEPRECATED] .editorconfig extension for Visual Studio Code 
clrmd,Microsoft.Diagnostics.Runtime is a set of APIs for introspecting processes and dumps.
Pyjion,Pyjion - A JIT for Python based upon CoreCLR
Lumia-imaging-sdk,"Lumia Imaging SDK is a comprehensive set of GPU/CPU imaging tools and effects that run on both mobile and desktop, with high speed and memory efficiency. Samples and extras code are included."
VisualStudioUninstaller,Visual Studio Uninstallation sometimes can be unreliable and often leave out a lot of unwanted artifacts. Visual Studio Uninstaller is designed to thoroughly and reliably remove these unwanted artifacts.
VSLua,Visual Studio Tools for Lua
vscode-vsce,VS Code Extension Manager
vsts-cordova-tasks,"Streamline CI setup for your Apache Cordova, PhoneGap, Ionic, or Cordova CLI compatible app using a set of useful pre-defined build steps for VS Team Services or TFS"
TVHelpers,"This project consists of several helper components, samples, and sample app to help you get started building applications for media, TV, and Xbox on the Universal Windows Platform for both C# and JavaScript developers."
Ironclad,The MSR Ironclad project builds provably secure and reliable systems.
CRM-Performance-Toolkit,The Microsoft Dynamics CRM 2015 Performance Toolkit was created by the Microsoft CRM product team to formalize performance testing of Microsoft CRM 2013 and later releases. The performance toolkit can be used by the Microsoft CRM partners and customers to collect data to support their CRM deployment decisions.
vscode-samples,VS Code Samples
vscode-generator-code,Visual Studio Code extension generator
PowerBI-CSharp,Welcome to the .NET developer community for Power BI. Here you will find resources for the .NET SDKs for Power BI Embedded V2.0.0
PowerBI-JavaScript,JavaScript library for embedding Power BI into your apps. Check out the docs website and wiki for more information.
graphics-driver-samples,This repository contains graphics driver samples used to demonstrate how to write graphics driver for the windows platform.
TypeScript-DOM-lib-generator,Tool for generating dom related TypeScript and JavaScript library files 
code-push,A cloud service that enables Cordova and React Native developers to deploy mobile app updates directly to their users’ devices.
deep-space,Sample web application written in Java and uses AngularJS.
binskim,A binary static analysis tool that provides security and correctness results for Windows Portable Executable and *nix ELF binary formats
JSanity,"A secure-by-default, performance, cross-browser client-side HTML sanitization library"
vscode-MDTools,This is a sample markdown extension e.g. wordcount and toUpper
taco-simulate,Module to support Cordova plugin simulation in TACO CLI.
cordova-simulate,Simulates your Apache Cordova application in the browser.
shelljs,Portable Unix shell commands for Node.js
vscode-mock-debug,Starter sample for developing debug adapters for VSCode.
ntttcp-for-linux,A Linux network throughput multiple-thread benchmark tool.
vscode-tslint,A tslint integration for vscode
StopGuessing,A system for protecting password-based authentication systems from online-guessing attacks.
vscode-extension-vscode,The vscode NPM module. Deprecated in favor of @types/vscode and vscode-test.
vscode-wordcount,Sample Word Count extension for VS Code.
linkcheckermd,A VSCode extension that check links in Markdown to ensure they are valid.
distributed_word_embedding,Distributed word embedding
distributed_skipgram_mixture,Distributed skipgram mixture model for multisense word embedding
ApplicationInsights-dotnet-server,Microsoft Application Insights for .NET Web Applications
vscode-comment,Adds simple jsdoc comments for the parameters of a selected function signature
vscode-go,An extension for VS Code which provides support for the Go language. We have moved to https://github.com/golang/vscode-go
TouchDevelop-backend,Back-end cloud service for Touch Develop.
pict,Pairwise Independent Combinatorial Tool
vso-httpclient-java,Microsoft Visual Studio Online HTTP Client for Java
vscode-docker,Docker Extension for Visual Studio Code
generator-docker,Yeoman generator for Docker
moodle-block_microsoft,moodle-block_microsoft
ProjectOxford-ClientSDK,This repo has moved :house: Visit our website for the latest SDKs & Samples
prose,Microsoft Program Synthesis using Examples SDK is a framework of technologies for the automatic generation of programs from input-output examples. This repo includes samples and sample data for the Microsoft Program Synthesis using Example SDK.
vscode-htmltagwrap,Wraps a chunk of HTML code in tags
HealthClinic.biz,"The samples contained in this repo are used to present an end-to-end demo scenario based on a fictitious B2B and multitenant system, named “HealthClinic.biz” that provides different websites, mobile apps, desktop apps, wearable apps, and services running on the latest Microsoft and open technologies aligned with announcements to showcase during the Connect(); 2015 event.

The current published version works with Visual Studio 2015 Update 1 RC bits and ASP.NET 5.0 Beta 8. The final version used at Connect(); 2015 will be published soon."
TypeScript-TmLanguage,"TextMate grammar files for TypeScript for VS Code, Sublime Text, and Atom."
code-push-vsts-extension,Visual Studio Team Services (VSTS) extension for performing continuous delivery to the CodePush service from your automated CI builds
XLIFF2-Object-Model,If you’re looking to store localization data and propagate it through your localization pipeline allowing tools to interoperate then you may want to use the XLIFF 2.0 object model.  The XLIFF 2.0 object model implements the OASIS Standard for the XLIFF 2.0 specification as defined at http://docs.oasis-open.org/xliff/xliff-core/v2.0/xliff-core-v2.0.html.
caffe,Caffe on both Linux and Windows
vscode-eslint,VSCode extension to integrate eslint into VSCode
vscode-jshint,VSCode extension to integrate jshint into VSCode
dockertools-sampleprojects,Sample projects from Docker tools team.
mattercenter,"Microsoft’s Corporate, External, and Legal Affairs (CELA) group, in partnership with the Office extensibility team, developed Matter Center for Office 365 -- a document management and collaboration solution built using the Office app development model, Azure and Sharepoint."
Mobius,C# and F# language binding and extensions to Apache Spark
VSSDK-Extensibility-Templates,Visual Studio item templates for building your own extensions
DockerToolsDocs,Documentation for Docker Developer Tools
vscode-jscs,VS Code JSCS Extension (deprecated)
microsoft-pdb,Information from Microsoft about the PDB format.  We'll try to keep this up to date. Just trying to help the CLANG/LLVM community get onto Windows.
ApplicationInsights-Announcements,Subscribe to this repo to be notified about major changes in Application Insights.
vscode-spell-check,An extension to VSCode for spell and grammar checking.
nodejs-guidelines,"Tips, tricks, and resources for working with Node.js, and the start of an ongoing conversation on how we can improve the Node.js experience on Microsoft platforms."
vscode-chrome-debug,Debug your JavaScript code running in Google Chrome from VS Code.
vss-web-extension-sdk,Visual Studio Teams Service Web Extension SDK
vsts-nuget-bootstrapper,Contains the code used to bootstrap nuget.exe for VSTS feeds
Partner-app-development,"Samples for partner application development (OEM, MO, IHV) for Window"
hdfs-mount,A tool to mount HDFS as a local Linux file system
Imagine_block-knock,"Get the assets and code here, and then follow our Block Knock tutorial to learn more about how to work with Unity, C#, and Visual Studio to complete this game! Microsoft Imagine connects you with the tools and knowledge you need to create, code, and develop your ideas."
vscode-extension-samples,Sample code illustrating the VS Code extension API.
sarif-sdk,".NET code and supporting files for working with the 'Static Analysis Results Interchange Format' (SARIF, see https://github.com/oasis-tcs/sarif-spec)"
driver-utilities,Driver utilities for building static analysis and other command-line tools.
ts-api-checker,Utility to check the compatibility between two versions of a TypeScript declare file.
vscode-LaTeX,A colorizer and set of snippets for LaTeX
R-Host,A host process for R that provides access and extensibility to it remotely over WebSocket and JSON.
DMTK,Microsoft Distributed Machine Learning Toolkit
Git-Credential-Manager-for-Mac-and-Linux,Git Credential Manager for Mac and Linux stores credentials for Git version control securely. Provides secure logon for Visual Studio Team Services (visualstudio.com).
vscode-mono-debug,A simple VS Code debug adapter for mono
hiredis,Minimalistic C client for Redis >= 1.2
oauth2-useragent,"Microsoft OAuth 2.0 User Agent library for Java. Provides classes to facilitate the implementation of ""4.1. Authorization Code Grant"" from RFC 6749."
cortana-samples,Code samples for Cortana extensibility.
Font-Validator,Font Validator is a tool for testing fonts prior to release. This testing ensures that fonts meet Microsoft's high quality standards and perform exceptionally well on Microsoft's platform.
vscode-node-debug,A VS Code debug adapter for node
MixedRealityToolkit,The MixedRealityToolkit is a collection of scripts and components intended to accelerate the development of mixed reality applications targeting Windows Mixed Reality.
vscode-loader,An universal Asynchronous Module Definition (AMD) Loader developed primarily to load VSCode's sources.
vscode-themes,A repo used for the theme kits
vscode-filewatcher-windows,The file watcher used for VS Code on Windows.
ApplicationInsights-dotnet-logging,.NET Logging adaptors
fonts,Central location to share Microsoft's open source fonts
opensource-management-portal,Microsoft's monolithic GitHub Management Portal enabling enterprise scale self-service powered by the GitHub API 🏔🧑‍💻🧰
Imagine_binary-break-in,"Get the assets and code here, and then follow our Binary Break-In tutorial to learn more about how to work with Unity, C#, and Visual Studio to complete this game! Microsoft Imagine connects you with the tools and knowledge you need to create, code, and develop your ideas."
Imagine_diamond-miner,"Get the assets and code here, and then follow our Diamond Miner tutorial to learn more about how to work with Unity, C#, and Visual Studio to complete this game! Microsoft Imagine connects you with the tools and knowledge you need to create, code, and develop your ideas."
microbit-chrome,Prototype chrome addon that exposes the micro:bit's serial output to webpages.
cordova-plugin-hockeyapp,cordova plugin for hockeyapp (ios & android)
SDN,This repo includes PowerShell scripts and VMM service templates for setting up the Microsoft Software Defined Networking (SDN) Stack using Windows Server 2016
vscode-npm-scripts,VSCode extension for running npm-scripts and validating the package.json files.
vsts-branch-delete,Branch Delete Extension for Visual Studio Team Services
TSS.MSR,The TPM Software Stack from Microsoft Research
hummingbird-exchange,Sample that demonstrates how distribution groups can be converted to Office365 groups.
vscode-htmlhint,"VS Code integration of HTMLHint, an HTML linter."
spinnaker,"Spinnaker is an open source, multi-cloud continuous delivery platform for releasing software changes with high velocity and confidence."
clouddriver,read and write operations across cloud providers
orca,orchestration engine
front50,Cross-Application Persistence Service
gate,Spinnaker API Gateway
deck,New and improved management UI
ApplicationInsights-Docker-Dockerfile,Continues integration for Application Insights for Docker image
omi,Open Management Infrastructure
pal,Platform Abstraction Layer (both SCXCoreLib and SCXSystemLib)
SCXcore,System Center Cross Platform Provider for Operations Manager
Build-OMS-Agent-for-Linux,Build projects required for omsagent
Imagine_fudge-roll,"Get the assets and code here, and then follow our Fudge Roll tutorial to learn more about how to work with Unity, C#, and Visual Studio to complete this game! Microsoft Imagine connects you with the tools and knowledge you need to create, code, and develop your ideas."
GraphView,GraphView is a DLL library that enables users to use SQL Server or Azure SQL Database to efficiently manage graphs. 
CNTK,"Microsoft Cognitive Toolkit (CNTK), an open source deep-learning toolkit"
Dynamics-AX-Integration,Dynamics AX Integration samples and demos.
node-windows-mutex,Expose the Windows CreateMutex API to Node.JS
Yams,YAMS (Yet Another Microservices Solution) is a library that can be used to deploy and host microservices in the cloud (e.g. Azure) or on premises
Coding4Fun,Samples for exploring the lighter side of Windows 10 (UWP) development
Build-SCXcore,Build projects required for SCXCore (Operations Manager) agent
MIMWAL,The MIMWAL is a Workflow Activity Library (WAL) solution for configuring complex Workflows in the Microsoft Identity Manager (MIM) 2016 and Forefront Identity Manager (FIM) 2010 R2 solution.
VS-PPT,Productivity Power Tools - a set of Visual Studio extensions improving developer productivity.
Phoenix,"Azure Pack Connector extends Azure Pack to public Azure. Administrators and tenants use the Azure Pack portal to configure Azure subscriptions, and provision and manage IaaS VMs."
vscode-debugadapter-node,Debug adapter protocol and implementation for VS Code.
xblock-onedrive,edX XBlock for Microsoft OneDrive
xblock-oembed,edX XBlock for services supporting the OEmbed protocol
Selawik,This will provide a location for Selawik development to take place.
Build-PowerShell-DSC-for-Linux,Build projects required for DSC (Desired State Configuration)
Angara.Statistics,A collection of statistics algorithms from Mersenne twister generator to MCMC sampling.
vsts-react-native-tasks,Streamline CI setup for your React Native app using a set of useful pre-defined build steps.
MySQL-Provider,MySQL Monitoring Agent for OMI Server
Apache-Provider,Apache Monitoring Agent for OMI Server
sqlskim,TSQL Linter and database verifier
customer-scripts,Repository of scripts provided frequently to our customers
ftl-sdk,Software Development Kit for Mixer's FTL Protocol
react-native-windows,A framework for building native Windows apps with React.
node-native-keymap,Provide OS keyboard layout functionality as a nodejs module
OMS-docker,Docker image for OMS (Operations Management Suite) Linux agent.
ivy,"IVy is a research tool intended to allow interactive development of protocols and their proofs of correctness and to provide a platform for developing and experimenting with automated proof techniques. In particular, IVy provides interactive visualization of automated proofs, and supports a use model in which the human protocol designer and the automated tool interact to expose errors and prove correctness."
clock,:clock4: Time utility with lovely mocking support
ProjectOxford-Apps-MimickerAlarm,Project Oxford Mimicker Alarm
NoSQLProvider,A cross-browser/platform indexeddb-like client library
SyncTasks,An explicitly non-A+ Promise library that resolves promises synchronously
cordova-plugin-livereload,Plugin to enable livereload and gestures synchronization across devices for Cordova
vscode-cordova,"A Visual Studio Code extension providing intellisense, debug, and build support for Cordova and Ionic projects."
routebox,Transparent catbox-based response caching for Hapi servers
CNTK-docker,Microsoft Cognitive Toolkit (CNTK) Docker Images
openscraping-lib-csharp,Turn unstructured HTML pages into structured data. The OpenScraping library can extract information from HTML pages using a JSON config file with xPath rules. It can scrape even multi-level complex objects such as tables and forum posts. This is the C# version.
SLAyer,SLAyer is an automatic formal verification tool that uses separation logic to verify memory safety of C programs.
Appsample-Photosharing,Sample code for a UWP photo sharing app.
Build-Apache-Provider,Superproject for Apache-Provider Project
Build-MySQL-Provider,Superproject for MySQL-Provider Project
MIMPowerShellConnectors,A collection of data connectors for Microsoft Identity Manager that utilize the PowerShell connector framework
ostc-openssl,Superproject repository with specific SSL versions required for OSTC ULinux Builds
azure-pipelines-agent-cookbook,Chef Cookbook to install and manage Azure Pipelines Agent for Build and Release tasks
Angara.Serialization,An extendible library for serialization of an arbitrary objects to JSON format extended with type information to facilitate interoperability between .NET and JavaScript platforms.
vscode-react-native,VSCode extension for React Native - supports debugging and editor integration
vsts-jenkins-build-integration-sample,Sample code that publishes Jenkins build results to VSTS.
pbuild,Private (developer) build system
ostc-docs,Documentation for the OSTC team
colinmarc-hdfs,A native go client for HDFS
pxt,Microsoft MakeCode (PXT - Programming eXperience Toolkit)
ace,Build Cordova apps with true native UI
Windows-appsample-huelightcontroller,Sample app for Philips Hue lighting with Cortana and Bluetooth LE for the Universal Windows Platform.
google-play-vsts-extension,Visual Studio Team Services (VSTS) extension for performing continuous delivery to the Google Play store from your automated CI builds
app-store-vsts-extension,Visual Studio Team Services (VSTS) extension for performing continuous delivery to the App Store store from your automated CI builds
MixedRealityToolkit-Unity,Mixed Reality Toolkit (MRTK) provides a set of components and features to accelerate cross-platform MR app development in Unity.
process-customization-scripts,sample scripts for customers who are exporting and importing process templates to/from TFS
vsts-bamboo-build-integration-sample,Sample code that publishes Bamboo build results to VSTS.
GetVSTSBuildUsage,This is a code sample to show how to get information about builds  run under a Visual Studio Team Services (VSTS) account or a collection on a Team Foundation Server (TFS).
Angara,Angara: the modelling environment https://www.microsoft.com/en-us/research/project/distribution-modeller
go-winio,Win32 IO-related utilities for Go
Windows-task-snippets,Reusable code snippets for the Universal Windows Platform.
vscode-nls,npm module to support externalization and localization of VSCode extensions.
vsts-tomcat,This contains tomcat tasks for vsts build and rm
Angara.Table,"A library that contains types for table representation and operations to manipulate with tables, as well as save and load them from text files such as CSV files."
Angara.Chart,"Allows to define and display a chart as a collection of plots such as line, band, markers, heatmap. Supports visualization of uncertain values represented as quantiles."
vsts-veracode,Veracode security scanning build extension for Visual Studio Team Services
ghinsights,"GHInsights is a data processing pipeline using Azure Data Factory and Azure Data Lake. It processes GitHub data from the ghtorrent project. The resulting processed data is available in Azure Data Lake for users to query, generate reports, and analyze GitHub projects."
vscode-extension-telemetry,Node module to help VS Code extensions send telemetry using application insights
vscode-nls-dev,The tools automates the extraction of strings to be externalized from TS and JS code. It therefore help localizing VSCode extensions and language servers written in TS and JS
types-publisher,This repo has moved:
painless-config,Low friction library for application configuration.
RTVS-docs,RTVS documentation and samples
HolographicAcademy,This is the home of all code assets necessary for the Holographic Academy.
Availability-Monitor-for-Kafka,"A tool to monitor Kafka availability and latency and report these metrics to SQL Server, JMX, CSV, SLF4J endpoints."
keen,Golang implementation of the Keen.io SDK.
yaral,Yet Another RAte Limit (plugin for Hapi)
CSharpClient-for-Kafka,.Net implementation of the Apache Kafka Protocol that provides basic functionality through Producer/Consumer classes. The project also offers balanced consumer implementation.
team-explorer-everywhere,Team Explorer Everywhere Plugin for Eclipse
thrifty,Thrift for Android that saves you methods
checkedc,"Checked C is an extension to C that lets programmers write C code that is guaranteed by the compiler to be type-safe.  The goal is to let people easily make their existing C code type-safe and eliminate entire classes of errors. Checked C does not address use-after-free errors. This repo has a wiki for Checked C, sample code, the specification, and test code."
Xbox-ATG-Samples,Game development samples published by the Xbox Advanced Technology Group using the Xbox One XDK and for the Universal Windows Platform (UWP).
pxt-microbit-core,Core library for kindscript-microbit target
EmbeddedSocial-Android-SDK,SDK for interacting with the Microsoft Embedded Social service from inside your Android app
EmbeddedSocial-iOS-SDK,SDK for interacting with the Microsoft Embedded Social service from inside your iOS app
EmbeddedSocial-Java-API-Library,Library for interacting with the Microsoft Embedded Social API in your Java code.
EmbeddedSocial-NodeJS-API-Library,Library for interacting with the Microsoft Embedded Social API in your Node.JS code.
dotnet-computevirtualization,Sample class library for interfacing with Windows host compute service.
vscode-resharper-keybindings,Resharper 9 Keybindings port to VS Code. 
SQL-Server-R-Services-Samples,Advanced analytics samples and templates using SQL Server R Services
TpmRCDecoder,TPM Return Code Decoder: decode error return codes for TPM 1.2 and TPM 2.0
azure-pipelines-agent,Azure Pipelines Agent 🚀
azure-vhd-utils,Azure VHD utilities.
botframework-sdk,Bot Framework provides the most comprehensive experience for building conversation applications.
GalaxyExplorer,Galaxy Explorer is the application Microsoft is building as part of the Share Your Idea campaign.
azure-repos-vscode,Azure Repos extension for VS Code
